{
  "$schema": "../schema/external.schema.json",
  "slug": "digital-goods",
  "type": "plugin",
  "source": {
    "kind": "github-release",
    "repo": "mindstellar/shopclass-plugin-digital-goods"
  },
  "asset_pattern": "^digital-goods_.*\\.zip$",
  "categories": ["listings-moderation", "storage-media"],
  "tags": ["downloads", "files", "digital", "attachments"],
  "short_description": "Let sellers attach downloadable files to a listing, stored privately and served through a gated link.",
  "icon": "https://raw.githubusercontent.com/mindstellar/shopclass-plugin-digital-goods/main/assets/icon.svg",
  "screenshots": [
    {
      "src": "https://raw.githubusercontent.com/mindstellar/shopclass-plugin-digital-goods/main/assets/screenshot-1.png",
      "caption": "Who can download, file limits, and charging sellers for attachments"
    }
  ],
  "license": "GPL-3.0-or-later",
  "support": {
    "issues": "https://github.com/mindstellar/shopclass-plugin-digital-goods/issues",
    "docs": "https://github.com/mindstellar/shopclass-plugin-digital-goods#readme"
  }
}
