{
  "$schema": "../schema/external.schema.json",
  "slug": "listing-import",
  "type": "plugin",
  "source": {
    "kind": "github-release",
    "repo": "mindstellar/shopclass-plugin-listing-import"
  },
  "asset_pattern": "^listing-import_.*\\.zip$",
  "categories": ["admin-tools"],
  "tags": ["import", "api", "feed", "csv", "rss"],
  "short_description": "Import listings from other systems through the site's REST API or scheduled JSON, CSV and RSS feeds.",
  "icon": "https://raw.githubusercontent.com/mindstellar/shopclass-plugin-listing-import/main/assets/icon.svg",
  "screenshots": [
    { "src": "https://raw.githubusercontent.com/mindstellar/shopclass-plugin-listing-import/main/assets/screenshot-1.png", "caption": "Sources: partners who send listings, and feeds this site fetches" },
    { "src": "https://raw.githubusercontent.com/mindstellar/shopclass-plugin-listing-import/main/assets/screenshot-2.png", "caption": "Fetch a JSON, CSV or RSS feed on a schedule" },
    { "src": "https://raw.githubusercontent.com/mindstellar/shopclass-plugin-listing-import/main/assets/screenshot-3.png", "caption": "Preview a feed before it changes anything" },
    { "src": "https://raw.githubusercontent.com/mindstellar/shopclass-plugin-listing-import/main/assets/screenshot-4.png", "caption": "A help screen with the API guide" }
  ],
  "license": "GPL-3.0-or-later",
  "support": {
    "issues": "https://github.com/mindstellar/shopclass-plugin-listing-import/issues",
    "docs": "https://github.com/mindstellar/shopclass-plugin-listing-import#readme"
  }
}
