{
  "$schema": "../schema/external.schema.json",
  "slug": "paypal",
  "type": "plugin",
  "source": {
    "kind": "github-release",
    "repo": "mindstellar/shopclass-plugin-paypal"
  },
  "asset_pattern": "^paypal_.*\\.zip$",
  "categories": [
    "payments"
  ],
  "tags": [
    "billing",
    "payments",
    "paypal",
    "checkout"
  ],
  "short_description": "Take payments for shop orders and credit packages through PayPal Checkout, with verified webhooks and refunds from the admin.",
  "icon": "https://raw.githubusercontent.com/mindstellar/shopclass-plugin-paypal/main/assets/icon.svg",
  "license": "GPL-3.0-or-later",
  "support": {
    "issues": "https://github.com/mindstellar/shopclass-plugin-paypal/issues",
    "docs": "https://github.com/mindstellar/shopclass-plugin-paypal#readme"
  }
}
