{
  "$schema": "../schema/external.schema.json",
  "slug": "nginx-cache",
  "type": "plugin",
  "source": {
    "kind": "github-release",
    "repo": "mindstellar/shopclass-plugin-nginx-cache"
  },
  "asset_pattern": "^nginx-cache_.*\\.zip$",
  "categories": ["admin-tools"],
  "tags": ["nginx", "cache", "purge", "performance", "fastcgi"],
  "short_description": "Hold pages in nginx's FastCGI cache for an hour instead of thirty seconds, and purge them the moment a listing changes.",
  "icon": "https://raw.githubusercontent.com/mindstellar/shopclass-plugin-nginx-cache/main/assets/icon.svg",
  "screenshots": [
    {
      "src": "https://raw.githubusercontent.com/mindstellar/shopclass-plugin-nginx-cache/main/assets/screenshot-1.png",
      "caption": "A verified purge, and how long each kind of page is held"
    },
    {
      "src": "https://raw.githubusercontent.com/mindstellar/shopclass-plugin-nginx-cache/main/assets/screenshot-2.png",
      "caption": "The nginx setup, generated for this install"
    }
  ],
  "license": "GPL-3.0-or-later",
  "support": {
    "issues": "https://github.com/mindstellar/shopclass-plugin-nginx-cache/issues",
    "docs": "https://github.com/mindstellar/shopclass-plugin-nginx-cache#readme"
  }
}
