{
  "$schema": "../schema/external.schema.json",
  "slug": "map-search",
  "type": "plugin",
  "source": {
    "kind": "github-release",
    "repo": "mindstellar/shopclass-plugin-map-search"
  },
  "asset_pattern": "^map-search_.*\\.zip$",
  "categories": ["search"],
  "tags": ["map", "search", "maplibre", "openstreetmap", "location"],
  "short_description": "A map of listings on the search page, with pin clusters and a \"Search this area\" button. Free OpenFreeMap tiles by default, no key.",
  "icon": "https://raw.githubusercontent.com/mindstellar/shopclass-plugin-map-search/main/assets/icon.svg",
  "screenshots": [
    {
      "src": "https://raw.githubusercontent.com/mindstellar/shopclass-plugin-map-search/main/assets/screenshot-1.png",
      "caption": "The map above the search results"
    }
  ],
  "license": "GPL-3.0-or-later",
  "support": {
    "issues": "https://github.com/mindstellar/shopclass-plugin-map-search/issues",
    "docs": "https://github.com/mindstellar/shopclass-plugin-map-search#readme"
  }
}
